{
  "$schema": "../../schema/species-rules.schema.json",
  "id": "species-intro",
  "title": "Descrições das Espécies",
  "source": {
    "book": "Livro do Jogador 2024",
    "language": "pt-BR",
    "chapter": 4,
    "chapterTitle": "Origens dos Personagens",
    "pdfPath": "doc/livro-jogador.pdf",
    "pdfPages": [
      192,
      203
    ],
    "extractedAt": "2026-06-25T23:51:33.040Z"
  },
  "content": "Dez espécies são apresentadas nesta seção em ordem alfabética: Aasimar, Anão, Draconato, Elfo, Gnomo, Golias, Humano, Orc, Pequenino e Tiferino. A"
}
